{
  "schema_version": "1.0",
  "message_type": "approval_packet",
  "created_at": "2026-07-18T10:06:00Z",
  "safety_flags": {
    "synthetic_local_only": true,
    "mock_only": true,
    "dry_run": true,
    "owner_review_required": true,
    "external_side_effects_allowed": false,
    "external_side_effects_occurred": false,
    "blackboard_write_allowed": false,
    "queue_write_allowed": false,
    "audit_trail_write_allowed": false,
    "worker_dispatch_allowed": false,
    "openclaw_call_allowed": false,
    "hermes_runtime_allowed": false,
    "connector_call_allowed": false,
    "google_sheets_write_allowed": false,
    "follow_up_allowed": false,
    "follow_up_requires_owner_confirmation": true
  },
  "prev_entry_hash": "1111111111111111111111111111111111111111111111111111111111111111",
  "execution_class": "AUTO",
  "produced_by": "approval-packet-builder",
  "parent_task_id": null,
  "role": "owner_approval_packet_producer",
  "approval_packet_id": "approval-dryrun-phase3-001-result-phase3-001",
  "task_id": "task-phase3-001",
  "action_summary": "Prepare a mock command envelope without dispatch.",
  "risk_level": "low",
  "exact_target": {
    "action_type": "n1_harmless_query",
    "task_id": "task-phase3-001",
    "command_id": "cmd-phase3-001",
    "query_action": "Prepare a mock command envelope without dispatch."
  },
  "expected_side_effects": [],
  "rollback_path": "No rollback needed because nothing was executed.",
  "timeout": 30,
  "dry_run_evidence": {
    "dry_run_id": "dryrun-phase3-001",
    "result_id": "result-phase3-001",
    "result_status": "preview_result_not_executed",
    "preview_only": true
  },
  "audit_trail_preview": {
    "summary": "Preview only; no audit trail was persisted.",
    "persisted": false
  },
  "approval_timestamp": "2026-07-18T10:07:00Z",
  "single_use_execution_token": null,
  "decision": "approve"
}
